brand,name,rating,votes,url,last_crawled
Clive Christian,20 Iconic Feminine Clive Christian,3.72,125,https://www.fragrantica.com/perfume/Clive-Christian/20-Iconic-Feminine-57888.html,2025-11-14T20:21:42.180318
Clive Christian,E for Men Gourmand Oriental With Sweet Clove Clive Christian,4.04,323,https://www.fragrantica.com/perfume/Clive-Christian/E-for-Men-Gourmand-Oriental-With-Sweet-Clove-47346.html,2025-11-14T20:21:48.114345
Clive Christian,Sandalwood Absolute Oil Clive Christian for women and men,4.0,7,https://www.fragrantica.com/perfume/Clive-Christian/Sandalwood-Absolute-Oil-42475.html,2025-11-14T20:21:54.237499
Clive Christian,No. 1 Imperial For Men Clive Christian,3.68,22,https://www.fragrantica.com/perfume/Clive-Christian/No-1-Imperial-For-Men-29024.html,2025-11-14T20:22:00.267006
Clive Christian,A Separate Reality Manic Clive Christian,4.25,20,https://www.fragrantica.com/perfume/Clive-Christian/A-Separate-Reality-Manic-63055.html,2025-11-14T20:22:06.621096
Clive Christian,Jasmin Absolute Oil Clive Christian for women and men,3.83,6,https://www.fragrantica.com/perfume/Clive-Christian/Jasmin-Absolute-Oil-42477.html,2025-11-14T20:22:12.871476
Clive Christian,1872 For Men Clive Christian,4.33,1450,https://www.fragrantica.com/perfume/Clive-Christian/1872-For-Men-4646.html,2025-11-14T20:22:19.845287
Clive Christian,Vision in a Dream Mesmeric Clive Christian,3.97,105,https://www.fragrantica.com/perfume/Clive-Christian/Vision-in-a-Dream-Mesmeric-47117.html,2025-11-14T20:22:26.492758
Clive Christian,Osmanthus Absolut Oil Clive Christian for women and men,3.33,3,https://www.fragrantica.com/perfume/Clive-Christian/Osmanthus-Absolut-Oil-52415.html,2025-11-14T20:22:33.039686
Clive Christian,L for Men Woody Oriental With Deep Amber Clive Christian,3.87,89,https://www.fragrantica.com/perfume/Clive-Christian/L-for-Men-Woody-Oriental-With-Deep-Amber-47353.html,2025-11-14T20:22:39.477988
Clive Christian,Chasing the Dragon Hypnotic Clive Christian,4.09,131,https://www.fragrantica.com/perfume/Clive-Christian/Chasing-the-Dragon-Hypnotic-47120.html,2025-11-14T20:22:45.535218
Clive Christian,A Separate Reality Soporific Clive Christian,4.12,24,https://www.fragrantica.com/perfume/Clive-Christian/A-Separate-Reality-Soporific-63056.html,2025-11-14T20:22:51.518884
Clive Christian,X Twist Myrrh Clive Christian for women and men,4.56,25,https://www.fragrantica.com/perfume/Clive-Christian/X-Twist-Myrrh-45298.html,2025-11-14T20:22:58.087841
Clive Christian,Jump Up And Kiss Me Ecstatic (2021) Clive Christian for women and men,3.94,449,https://www.fragrantica.com/perfume/Clive-Christian/Jump-Up-And-Kiss-Me-Ecstatic-2021-70766.html,2025-11-14T20:23:04.594143
Clive Christian,No. 1 Twist Water Mint Clive Christian for women and men,4.14,7,https://www.fragrantica.com/perfume/Clive-Christian/No-1-Twist-Water-Mint-59179.html,2025-11-14T20:23:10.203882
Clive Christian,V for Women Fruity Floral With Dark Plum Clive Christian,3.76,96,https://www.fragrantica.com/perfume/Clive-Christian/V-for-Women-Fruity-Floral-With-Dark-Plum-47351.html,2025-11-14T20:23:17.158905
Clive Christian,X For Men Clive Christian,4.36,1610,https://www.fragrantica.com/perfume/Clive-Christian/X-For-Men-4650.html,2025-11-14T20:23:23.885485
Clive Christian,Vision in a Dream Psychedelic Clive Christian,4.2,111,https://www.fragrantica.com/perfume/Clive-Christian/Vision-in-a-Dream-Psychedelic-47118.html,2025-11-14T20:23:30.012848
Clive Christian,20 Iconic Masculine Clive Christian,4.41,227,https://www.fragrantica.com/perfume/Clive-Christian/20-Iconic-Masculine-57887.html,2025-11-14T20:23:36.049176
Clive Christian,V for Men Clive Christian,4.16,281,https://www.fragrantica.com/perfume/Clive-Christian/V-for-Men-14638.html,2025-11-14T20:23:41.953618
Clive Christian,Town & Country Clive Christian for women and men,4.2,595,https://www.fragrantica.com/perfume/Clive-Christian/Town-Country-83240.html,2025-11-14T20:23:47.657036
Clive Christian,Amberwood Clive Christian for women and men,4.25,294,https://www.fragrantica.com/perfume/Clive-Christian/Amberwood-73599.html,2025-11-14T20:23:54.465800
Clive Christian,X Twist Liquorice Clive Christian for women and men,4.58,31,https://www.fragrantica.com/perfume/Clive-Christian/X-Twist-Liquorice-67267.html,2025-11-14T20:24:00.498954
Clive Christian,X Twist Tabac Clive Christian for women and men,4.1,21,https://www.fragrantica.com/perfume/Clive-Christian/X-Twist-Tabac-45371.html,2025-11-14T20:24:07.509474
Clive Christian,X For Women Clive Christian,4.05,1077,https://www.fragrantica.com/perfume/Clive-Christian/X-For-Women-4652.html,2025-11-14T20:24:13.331613
Clive Christian,I for Men Amber Oriental With Rich Musk Clive Christian,3.95,129,https://www.fragrantica.com/perfume/Clive-Christian/I-for-Men-Amber-Oriental-With-Rich-Musk-47356.html,2025-11-14T20:24:19.921666
Clive Christian,Rose Absolute Oil Clive Christian for women and men,3.33,6,https://www.fragrantica.com/perfume/Clive-Christian/Rose-Absolute-Oil-42476.html,2025-11-14T20:24:25.979711
Clive Christian,XVII Baroque Siberian Pine Clive Christian,4.04,52,https://www.fragrantica.com/perfume/Clive-Christian/XVII-Baroque-Siberian-Pine-52253.html,2025-11-14T20:24:31.543895
Clive Christian,X Twist Baies Rose Clive Christian for women and men,4.5,12,https://www.fragrantica.com/perfume/Clive-Christian/X-Twist-Baies-Rose-45601.html,2025-11-14T20:24:37.349038
Clive Christian,Victoriana Cedar Leaf Clive Christian,3.53,17,https://www.fragrantica.com/perfume/Clive-Christian/Victoriana-Cedar-Leaf-51062.html,2025-11-14T20:24:43.557751
Clive Christian,No.1 Twist Cardamom Clive Christian for women and men,3.75,4,https://www.fragrantica.com/perfume/Clive-Christian/No-1-Twist-Cardamom-59180.html,2025-11-14T20:24:50.167906
Clive Christian,XXI Art Deco Vanilla Orchid Clive Christian,4.27,147,https://www.fragrantica.com/perfume/Clive-Christian/XXI-Art-Deco-Vanilla-Orchid-50752.html,2025-11-14T20:24:55.943204
Clive Christian,No. 1 15th Year Anniversary Women Clive Christian,3.82,17,https://www.fragrantica.com/perfume/Clive-Christian/No-1-15th-Year-Anniversary-Women-26232.html,2025-11-14T20:25:02.618707
Clive Christian,L for Men Clive Christian,4.13,213,https://www.fragrantica.com/perfume/Clive-Christian/L-for-Men-26134.html,2025-11-14T20:25:08.782519
Clive Christian,No. 1 Clive Christian,4.0,664,https://www.fragrantica.com/perfume/Clive-Christian/No-1-4653.html,2025-11-14T20:25:14.532517
Clive Christian,X Twist Oudh Clive Christian for women and men,4.41,22,https://www.fragrantica.com/perfume/Clive-Christian/X-Twist-Oudh-67715.html,2025-11-14T20:40:37.887477
Clive Christian,1872 Tarocco Orange Clive Christian,4.22,45,https://www.fragrantica.com/perfume/Clive-Christian/1872-Tarocco-Orange-50754.html,2025-11-14T20:40:44.102095
Clive Christian,C for Men Clive Christian,4.35,548,https://www.fragrantica.com/perfume/Clive-Christian/C-for-Men-9728.html,2025-11-14T20:40:50.077131
Clive Christian,No. 1 Twist Violet Clive Christian for women and men,4.52,31,https://www.fragrantica.com/perfume/Clive-Christian/No-1-Twist-Violet-39606.html,2025-11-14T20:40:55.547159
Clive Christian,No. 1 Twist Chamomile Clive Christian for women and men,4.18,22,https://www.fragrantica.com/perfume/Clive-Christian/No-1-Twist-Chamomile-39605.html,2025-11-14T20:41:01.330720
Clive Christian,C for Men Woody Leather With Oudh Intense Clive Christian,4.3,368,https://www.fragrantica.com/perfume/Clive-Christian/C-for-Men-Woody-Leather-With-Oudh-Intense-47337.html,2025-11-14T20:41:07.383925
Clive Christian,X Twist Saffron Clive Christian for women and men,4.37,19,https://www.fragrantica.com/perfume/Clive-Christian/X-Twist-Saffron-39249.html,2025-11-14T20:41:14.029338
Clive Christian,X Twist Narcissus Clive Christian for women and men,4.47,17,https://www.fragrantica.com/perfume/Clive-Christian/X-Twist-Narcissus-39250.html,2025-11-14T20:41:20.574008
Clive Christian,E Cashmere Musk Clive Christian for women and men,4.19,258,https://www.fragrantica.com/perfume/Clive-Christian/E-Cashmere-Musk-90448.html,2025-11-14T20:41:26.507152
Clive Christian,VIII Rococo Immortelle Clive Christian,3.95,228,https://www.fragrantica.com/perfume/Clive-Christian/VIII-Rococo-Immortelle-45206.html,2025-11-14T20:41:32.960254
Clive Christian,Baies Rose Iconic Elixir Clive Christian for women and men,4.5,4,https://www.fragrantica.com/perfume/Clive-Christian/Baies-Rose-Iconic-Elixir-57889.html,2025-11-14T20:41:39.112746
Clive Christian,X Twist Mate Tea Clive Christian,4.25,12,https://www.fragrantica.com/perfume/Clive-Christian/X-Twist-Mate-Tea-59178.html,2025-11-14T20:41:44.960763
Clive Christian,Jump Up And Kiss Me Hedonistic (2021) Clive Christian for women and men,4.29,1003,https://www.fragrantica.com/perfume/Clive-Christian/Jump-Up-And-Kiss-Me-Hedonistic-2021-70767.html,2025-11-14T20:41:51.078471
Clive Christian,L for Women Floral Chypre With Rich Patchouli Clive Christian,3.86,152,https://www.fragrantica.com/perfume/Clive-Christian/L-for-Women-Floral-Chypre-With-Rich-Patchouli-47354.html,2025-11-14T20:41:57.025034
Clive Christian,Chasing the Dragon Euphoric Clive Christian,4.16,152,https://www.fragrantica.com/perfume/Clive-Christian/Chasing-the-Dragon-Euphoric-47119.html,2025-11-14T20:42:03.822102
Clive Christian,Amber Absolute Oil Clive Christian for women and men,4.67,3,https://www.fragrantica.com/perfume/Clive-Christian/Amber-Absolute-Oil-52416.html,2025-11-14T20:42:10.514802
Clive Christian,No. 1 Clive Christian,3.95,868,https://www.fragrantica.com/perfume/Clive-Christian/No-1-4648.html,2025-11-14T20:42:17.136957
Clive Christian,Cosmos Flower Clive Christian,4.1,501,https://www.fragrantica.com/perfume/Clive-Christian/Cosmos-Flower-40131.html,2025-11-14T20:42:23.877419
Clive Christian,V for Women Clive Christian,3.92,219,https://www.fragrantica.com/perfume/Clive-Christian/V-for-Women-14637.html,2025-11-14T20:42:29.911134
Clive Christian,E for Women Green Fougere With Aromatic Lavender Clive Christian,4.04,89,https://www.fragrantica.com/perfume/Clive-Christian/E-for-Women-Green-Fougere-With-Aromatic-Lavender-47348.html,2025-11-14T20:42:36.948007
Clive Christian,Iconic Masculine Clive Christian,3.75,20,https://www.fragrantica.com/perfume/Clive-Christian/Iconic-Masculine-116034.html,2025-11-14T20:42:42.389912
Clive Christian,C for Women Green Floral With Scottish Heather Clive Christian,3.62,69,https://www.fragrantica.com/perfume/Clive-Christian/C-for-Women-Green-Floral-With-Scottish-Heather-47336.html,2025-11-14T20:42:48.649619
Clive Christian,C for Women Clive Christian,4.18,466,https://www.fragrantica.com/perfume/Clive-Christian/C-for-Women-9729.html,2025-11-14T20:42:54.748732
Clive Christian,Iconic Feminine Clive Christian,3.36,11,https://www.fragrantica.com/perfume/Clive-Christian/Iconic-Feminine-116035.html,2025-11-14T20:43:00.927929
Clive Christian,Timeless Clive Christian for women and men,4.41,240,https://www.fragrantica.com/perfume/Clive-Christian/Timeless-77140.html,2025-11-14T20:43:07.657686
Clive Christian,1872 Mandarin Clive Christian for women and men,3.98,41,https://www.fragrantica.com/perfume/Clive-Christian/1872-Mandarin-39178.html,2025-11-14T20:43:13.423912
Clive Christian,No. 1 15th Year Anniversary Men Clive Christian,4.38,16,https://www.fragrantica.com/perfume/Clive-Christian/No-1-15th-Year-Anniversary-Men-26231.html,2025-11-14T20:43:19.667025
Clive Christian,XX Art Nouveau Water Lily Clive Christian,4.06,79,https://www.fragrantica.com/perfume/Clive-Christian/XX-Art-Nouveau-Water-Lily-50928.html,2025-11-14T20:43:25.357880
Clive Christian,Crab Apple Blossom Clive Christian for women and men,4.03,739,https://www.fragrantica.com/perfume/Clive-Christian/Crab-Apple-Blossom-63461.html,2025-11-14T20:43:30.769538
Clive Christian,1872 Twist Acacia Clive Christian for women and men,4.32,19,https://www.fragrantica.com/perfume/Clive-Christian/1872-Twist-Acacia-45427.html,2025-11-14T20:43:37.516222
Clive Christian,No. 1 Imperial For Women Clive Christian,3.05,21,https://www.fragrantica.com/perfume/Clive-Christian/No-1-Imperial-For-Women-29025.html,2025-11-14T20:43:43.426442
Clive Christian,Jump up and Kiss Me Hedonistic Clive Christian,4.06,144,https://www.fragrantica.com/perfume/Clive-Christian/Jump-up-and-Kiss-Me-Hedonistic-47116.html,2025-11-14T20:43:50.063616
Clive Christian,1872 For Women Clive Christian,4.06,810,https://www.fragrantica.com/perfume/Clive-Christian/1872-For-Women-4647.html,2025-11-14T20:43:56.576416
Clive Christian,I for Women Woody Floral With Vintage Rose Clive Christian,4.16,210,https://www.fragrantica.com/perfume/Clive-Christian/I-for-Women-Woody-Floral-With-Vintage-Rose-47357.html,2025-11-14T20:44:02.210536
Clive Christian,1872 Vetiver Clive Christian for women and men,4.49,55,https://www.fragrantica.com/perfume/Clive-Christian/1872-Vetiver-39179.html,2025-11-14T20:44:07.733395
Clive Christian,V for Men Amber Fougere With Smoky Vetiver Clive Christian,4.07,181,https://www.fragrantica.com/perfume/Clive-Christian/V-for-Men-Amber-Fougere-With-Smoky-Vetiver-47350.html,2025-11-14T20:57:21.595999
Clive Christian,XVII Baroque Russian Coriander Clive Christian,4.06,70,https://www.fragrantica.com/perfume/Clive-Christian/XVII-Baroque-Russian-Coriander-52254.html,2025-11-14T20:57:27.609981
Clive Christian,Blonde Amber Clive Christian for women and men,4.57,1861,https://www.fragrantica.com/perfume/Clive-Christian/Blonde-Amber-73595.html,2025-11-14T20:57:33.935679
Clive Christian,Contemporary Clive Christian for women and men,4.3,184,https://www.fragrantica.com/perfume/Clive-Christian/Contemporary-77141.html,2025-11-14T20:57:39.712961
Clive Christian,L Red Tea Vetiver Clive Christian for women and men,4.04,208,https://www.fragrantica.com/perfume/Clive-Christian/L-Red-Tea-Vetiver-101977.html,2025-11-14T20:57:45.476027
Clive Christian,XXI Art Deco Cypress Clive Christian,4.59,301,https://www.fragrantica.com/perfume/Clive-Christian/XXI-Art-Deco-Cypress-50926.html,2025-11-14T20:57:52.134737
Clive Christian,Jump up and Kiss Me Ecstatic Clive Christian,4.1,238,https://www.fragrantica.com/perfume/Clive-Christian/Jump-up-and-Kiss-Me-Ecstatic-47115.html,2025-11-14T20:57:57.652056
Clive Christian,1872 Leather Clive Christian,4.19,16,https://www.fragrantica.com/perfume/Clive-Christian/1872-Leather-46828.html,2025-11-14T20:58:04.308464
Clive Christian,L for Women Clive Christian,4.0,220,https://www.fragrantica.com/perfume/Clive-Christian/L-for-Women-26133.html,2025-11-14T20:58:10.851417
Clive Christian,Victoriana Heliotrope Clive Christian,4.0,18,https://www.fragrantica.com/perfume/Clive-Christian/Victoriana-Heliotrope-51064.html,2025-11-14T20:58:16.288121
Clive Christian,Matsukita Clive Christian for women and men,4.22,922,https://www.fragrantica.com/perfume/Clive-Christian/Matsukita-65983.html,2025-11-14T20:58:22.551499
Clive Christian,1872 Twist Bergamot Clive Christian for women and men,4.6,20,https://www.fragrantica.com/perfume/Clive-Christian/1872-Twist-Bergamot-45426.html,2025-11-14T20:58:29.088950
Clive Christian,No. 1 Passant Guardant Clive Christian,3.58,24,https://www.fragrantica.com/perfume/Clive-Christian/No-1-Passant-Guardant-28245.html,2025-11-14T20:58:34.829170
Clive Christian,Rock Rose Clive Christian,4.21,663,https://www.fragrantica.com/perfume/Clive-Christian/Rock-Rose-40132.html,2025-11-14T20:58:40.289139
Clive Christian,1872 Basil Clive Christian,4.06,33,https://www.fragrantica.com/perfume/Clive-Christian/1872-Basil-50753.html,2025-11-14T20:58:46.303802
Clive Christian,1872 Twist Jasmine Clive Christian for women and men,4.38,8,https://www.fragrantica.com/perfume/Clive-Christian/1872-Twist-Jasmine-59902.html,2025-11-14T20:58:53.144148
Clive Christian,XX Art Nouveau Papyrus Clive Christian,4.05,114,https://www.fragrantica.com/perfume/Clive-Christian/XX-Art-Nouveau-Papyrus-50929.html,2025-11-14T20:58:59.610262
Clive Christian,1872 Orris Clive Christian,4.06,35,https://www.fragrantica.com/perfume/Clive-Christian/1872-Orris-46829.html,2025-11-14T20:59:05.613043
Clive Christian,X Twist Sichuan Pepper Clive Christian for women and men,4.15,34,https://www.fragrantica.com/perfume/Clive-Christian/X-Twist-Sichuan-Pepper-53326.html,2025-11-14T20:59:11.516001
Clive Christian,X Twist Tuberose Clive Christian for women and men,4.08,13,https://www.fragrantica.com/perfume/Clive-Christian/X-Twist-Tuberose-45600.html,2025-11-14T20:59:17.013169
Clive Christian,VIII Rococo Magnolia Clive Christian,4.14,312,https://www.fragrantica.com/perfume/Clive-Christian/VIII-Rococo-Magnolia-45207.html,2025-11-14T20:59:23.269955
